Genome ID,Genome Name,Organism Name,NCBI Taxon ID,Genome Status,Strain,Serovar,Biovar,Pathovar,MLST,Other Typing,Culture Collection,Type Strain,Completion Date,Publication,BioProject Accession,BioSample Accession,Assembly Accession,SRA Accession,GenBank Accessions,RefSeq Accessions,Sequencing Centers,Sequencing Status,Sequencing Platform,Sequencing Depth,Assembly Method,Chromosomes,Plasmids,Contigs,Genome Length,GC Content,PATRIC CDS,RefSeq CDS,Isolation Site,Isolation Source,Isolation Comments,Collection Date,Isolation Country,Geographic Location,Latitude,Longitude,Altitude,Depth,Other Environmental,Host Name,Host Gender,Host Age,Host Health,Body Sample Site,Body Sample Subsite,Other Clinical,AntiMicrobial Resistance,AntiMicrobial Resistance Evidence,Gram Stain,Cell Shape,Motility,Sporulation,Temperature Range,Optimal Temperature,Salinity,Oxygen Requirement,Habitat,Disease,Comments,Additional Metadata,Coarse Consistency,Fine Consistency,Checkm Completeness,Checkm Contamination,Genome Quality Flags,Genome Quality,Date Inserted,Date Modified
"1148757.3","Brucella melitensis S66","Brucella melitensis S66",1148757,"WGS","S66",,,,"MLST.Brucella_spp.14",," ",,"2012-02-28T00:00:00Z","22965081","PRJNA82603","SAMN02469569","GCA_000250775.2",,"AHWB00000000","-","Chinese PLA Institute for Disease Control and Prevention, Academy of Military Medical Sciences","WGS","Illumina GA IIx","450x","CLC Genomics Workbench v. 4.03",,,73,3287279,57.28,3293,,,"blood",,"2009","China","China: Jilin Province",,,,,,"Human, Homo sapiens",,,,,,,,,"Negative","Bacilli","No","No","Mesophilic","37C","Unknown","Aerobic","Multiple","Brucellosis","Polymorphism analysis of Brucella isolates from Jilin Province, China.",,99.9,99.2,100,1.7,,"Good","2014-12-08T22:10:39.393Z","2015-03-16T03:17:09.594Z"
"1198690.3","Brucella abortus CNGB 759","Brucella abortus CNGB 759",1198690,"WGS","CNGB 759",,"biovar 1",,"MLST.Brucella_spp.1",,,,"2013-04-16T00:00:00Z",,"PRJNA176530","SAMN01047741","GCA_000366145.1","SRR642802","AQMB00000000","-","Broad Institute","WGS","Illumina","171.0x","allpaths v. R41856",,,3,3285661,57.22,3352,3129,,,"Relapsed case","2004","Argentina","Argentina: Buenos Aires",,,,,,"Human, Homo sapiens",,,"Relapsed case",,,,,,,,,,,,,,,"Relapsed case","Examination of differences in pathogenic processes ",,99.6,98.7,100,,,"Good","2014-12-08T22:10:36.912Z","2015-03-16T03:17:09.594Z"
"1234597.4","Ochrobactrum intermedium M86","Ochrobactrum intermedium M86",1234597,"WGS","M86",,,,,," ",,"2013-01-23T00:00:00Z","23557353","PRJNA178498","SAMN02470612","GCA_000332835.1",,"AOGE00000000","-","National Centre for Cell Science","WGS","Ion torrent PGM","66.18x","MIRA v. 3.4.0",,,148,5188688,57.9,5305,5043,,"gastric biopsy","isolated from a patient with non ulcer gastric dyspesia","2005","India","India",,,,,,"Human, Homo sapiens",,,"non ulcer gastric dyspesia",,,,,,"Negative","Bacilli","Yes","No","Mesophilic","37C","NonHalophilic","Aerobic","Host Associated","Functional dyspepsia","The present study aims to study the genome organisation of Ochrobactrum intermedium M86 isolated from a patient with non ulcer gastric dyspesia.",,99.6,97.3,100,0.6,,"Good","2014-12-08T22:12:28.586Z","2015-03-16T03:17:09.594Z"
"224914.11","Brucella melitensis bv. 1 str. 16M","Brucella melitensis bv. 1 str. 16M",224914,"Complete","16M",,"biovar 1",,"MLST.Brucella_spp.7",,,,"2002-01-05T00:00:00Z","11756688,12271122","PRJNA180",,"GCA_000007125.1",,"AE008917,AE008918","NC_003317,NC_003318","Integrated Genomics","complete",,,,2,,2,3294931,57.2,3499,3198,,"infected goat","isolated from an infected goat and is pathogenic in humans",,,,,,,,,"Human, Homo sapiens",,,,,,,,,"-","Coccobacillus",,,"Mesophilic","37",,"Aerobic","Host-associated","Brucellosis","  Brucella melitensisstrain 16M. This strain was isolated from an infected goat and is pathogenic in humans.",,99.9,99.6,100,,,"Good","2014-12-08T22:10:39.527Z","2015-03-16T03:17:09.594Z"
"470735.4","Brucella inopinata BO1","Brucella sp. BO1",470735,"WGS","BO1",,,,"MLST.Brucella_spp.52",,,"Yes","2010-09-03T00:00:00Z",,"PRJNA41855","SAMN02472076","GCA_000182725.1",,"ADEZ00000000","NZ_ADEZ00000000","Virginia Bioinformatics Institute","assembly","Roche/454 FLX","17.4x","Newbler v. 2.0.00.22",,,55,3366774,57.06,3404,2982,,"breast implant wound fluid of a 71-year old female patient with clinical symptoms consistent with brucellosis","isolated from breast implant wound fluid of a 71-year old female patient with clinical symptoms consistent with brucellosis",,,,,,,,,"Human, Homo sapiens","female","71","clinical symptoms consistent with brucellosis",,,,,,"-","Coccobacillus","No","No","Mesophilic","37",,"Aerobic","Host-associated","Brucellosis","Brucella sp. BO1.B. inopinata type strain BO1 was isolated from breast implant wound fluid of a 71-year old female patient with clinical symptoms consistent with brucellosis.",,99.6,98.7,98.5,0.5,,"Good","2014-12-08T22:10:38.795Z","2015-03-16T03:17:09.594Z"
"546272.3","Brucella melitensis ATCC 23457","Brucella melitensis ATCC 23457",546272,"Complete","ATCC 23457",,,,,,"ATCC 23457",,"2009-03-25T00:00:00Z",,"PRJNA30561","SAMN02604296","GCA_000022625.1",,"CP001488,CP001489","NC_012441,NC_012442","Virginia Bioinformatics Institute|Los Alomos National Labs/Joint Genome Institute","complete",,,,2,,2,3311219,57.2,3486,3136,,"human blood and bone marrow samples","obtained from human blood and bone marrow samples",,,,,,,,,"Human, Homo sapiens",,,,,,,,,"-","Coccobacillus",,,"Mesophilic","-",,"Facultative","Host-associated","Brucellosis","Brucella melitensis ATCC 23457.Brucella melitensis ATCC 23457 (isolate 84) was obtained from human blood and bone marrow samples and will be used for comparative analysis.",,99.9,99.3,100,,,"Good","2014-12-08T22:10:39.051Z","2015-03-16T03:17:09.594Z"
"693750.4","Brucella sp. BO2","Brucella sp. BO2",693750,"WGS","BO2",,,,,,,,"2010-09-03T00:00:00Z",,"PRJNA41857","SAMN02472084","GCA_000177135.1",,"ADFA00000000","NZ_ADFA00000000","Virginia Bioinformatics Institute","assembly","Roche/454 FLX","25.7x","Newbler v. 2.0.00.22",,,174,3305941,57.18,3350,2971,,"lung biopsy of a patient with chronic destructive pneumonia","isolated from a lung biopsy of a patient with chronic destructive pneumonia",,,,,,,,,"Human, Homo sapiens",,,"chronic destructive pneumonia",,,,,,"-","Coccobacillus","No","No","Mesophilic","-",,"Aerobic","Host-associated","Brucellosis","Brucella sp. BO2.The BO2 strain was isolated from a lung biopsy of a patient with chronic destructive pneumonia.",,99.6,98.9,98.5,,,"Good","2014-12-08T22:10:39.975Z","2015-03-16T03:17:09.594Z"
